film_id,title,description,release_year,language_id,rental_duration,rental_rate,length,replacement_cost,rating,special_features,category_id,actor_id
580,CONQUERER NUTS,A Taut Drama of a Mad Scientist And a Man who must Escape a Pioneer in An Abandoned Mine Shaft,2006,1,4,4.99,173,14.99,G,"Commentaries,Deleted Scenes,Behind the Scenes",7,25
581,DALMATIONS SWEDEN,A Emotional Epistle of a Moose And a Hunter who must Overcome a Robot in A Manhattan Penthouse,2006,1,4,0.99,106,25.99,PG,"Trailers,Commentaries,Deleted Scenes",7,25
582,DATE SPEED,A Touching Saga of a Composer And a Moose who must Discover a Dentist in A MySQL Convention,2006,1,4,0.99,104,19.99,R,Commentaries,8,25
583,DESTINY SATURDAY,A Touching Drama of a Crocodile And a Crocodile who must Conquer a Explorer in Soviet Georgia,2006,1,4,4.99,56,20.99,G,"Trailers,Commentaries,Behind the Scenes",13,25
584,DOUBLE WRATH,A Thoughtful Yarn of a Womanizer And a Dog who must Challenge a Madman in The Gulf of Mexico,2006,1,4,0.99,177,28.99,R,"Trailers,Deleted Scenes,Behind the Scenes",2,25
585,FICTION CHRISTMAS,A Emotional Yarn of a A Shark And a Student who must Battle a Robot in An Abandoned Mine Shaft,2006,1,4,0.99,72,14.99,PG,"Trailers,Commentaries,Deleted Scenes,Behind the Scenes",9,25
586,HATE HANDICAP,A Intrepid Reflection of a Mad Scientist And a Pioneer who must Overcome a Hunter in The First Manned Space Station,2006,1,4,0.99,107,26.99,PG,"Trailers,Commentaries,Behind the Scenes",5,25
587,HEAVENLY GUN,A Beautiful Yarn of a Forensic Psychologist And a Frisbee who must Battle a Moose in A Jet Boat,2006,1,5,4.99,49,13.99,NC-17,Behind the Scenes,12,25
588,HOLES BRANNIGAN,A Fast-Paced Reflection of a Technical Writer And a Student who must Fight a Boy in The Canadian Rockies,2006,1,7,4.99,128,27.99,PG,"Commentaries,Behind the Scenes",15,25
589,LOVERBOY ATTACKS,A Boring Story of a Car And a Butler who must Build a Girl in Soviet Georgia,2006,1,7,0.99,162,19.99,PG-13,"Trailers,Behind the Scenes",13,25
590,MASSAGE IMAGE,A Fateful Drama of a Frisbee And a Crocodile who must Vanquish a Dog in The First Manned Space Station,2006,1,4,2.99,161,11.99,PG,"Commentaries,Behind the Scenes",2,25
591,MISSION ZOOLANDER,A Intrepid Story of a Sumo Wrestler And a Teacher who must Meet a A Shark in An Abandoned Fun House,2006,1,3,4.99,164,26.99,PG-13,Behind the Scenes,2,25
592,MUMMY CREATURES,A Fateful Character Study of a Crocodile And a Monkey who must Meet a Dentist in Australia,2006,1,3,0.99,160,15.99,NC-17,"Trailers,Behind the Scenes",15,25
593,POLISH BROOKLYN,A Boring Character Study of a Database Administrator And a Lumberjack who must Reach a Madman in The Outback,2006,1,6,0.99,61,12.99,PG,"Trailers,Commentaries,Deleted Scenes,Behind the Scenes",3,25
594,PRIMARY GLASS,A Fateful Documentary of a Pastry Chef And a Butler who must Build a Dog in The Canadian Rockies,2006,1,7,0.99,53,16.99,G,"Trailers,Deleted Scenes,Behind the Scenes",1,25
595,SABRINA MIDNIGHT,A Emotional Story of a Squirrel And a Crocodile who must Succumb a Husband in The Sahara Desert,2006,1,5,4.99,99,11.99,PG,"Trailers,Behind the Scenes",3,25
596,SWEDEN SHINING,A Taut Documentary of a Car And a Robot who must Conquer a Boy in The Canadian Rockies,2006,1,6,4.99,176,19.99,PG,"Deleted Scenes,Behind the Scenes",5,25
597,TROUBLE DATE,A Lacklusture Panorama of a Forensic Psychologist And a Woman who must Kill a Explorer in Ancient Japan,2006,1,6,2.99,61,13.99,PG,"Trailers,Commentaries,Behind the Scenes",16,25
598,ANACONDA CONFESSIONS,A Lacklusture Display of a Dentist And a Dentist who must Fight a Girl in Australia,2006,1,3,0.99,92,9.99,R,"Trailers,Deleted Scenes",2,4
599,ANGELS LIFE,A Thoughtful Display of a Woman And a Astronaut who must Battle a Robot in Berlin,2006,1,3,2.99,74,15.99,G,Trailers,13,4
600,BAREFOOT MANCHURIAN,A Intrepid Story of a Cat And a Student who must Vanquish a Girl in An Abandoned Amusement Park,2006,1,6,2.99,129,15.99,G,"Trailers,Commentaries",1,4
601,BED HIGHBALL,A Astounding Panorama of a Lumberjack And a Dog who must Redeem a Woman in An Abandoned Fun House,2006,1,5,2.99,106,23.99,NC-17,"Trailers,Commentaries,Deleted Scenes",6,4
602,BLADE POLISH,A Thoughtful Character Study of a Frisbee And a Pastry Chef who must Fight a Dentist in The First Manned Space Station,2006,1,5,0.99,114,10.99,PG-13,"Trailers,Behind the Scenes",7,4
603,BOONDOCK BALLROOM,A Fateful Panorama of a Crocodile And a Boy who must Defeat a Monkey in The Gulf of Mexico,2006,1,7,0.99,76,14.99,NC-17,Behind the Scenes,16,4
604,GHOSTBUSTERS ELF,A Thoughtful Epistle of a Dog And a Feminist who must Chase a Composer in Berlin,2006,1,7,0.99,101,18.99,R,"Trailers,Deleted Scenes,Behind the Scenes",2,4
605,GREEDY ROOTS,A Amazing Reflection of a A Shark And a Butler who must Chase a Hunter in The Canadian Rockies,2006,1,7,0.99,166,14.99,R,"Trailers,Commentaries,Deleted Scenes",7,4
606,HANOVER GALAXY,A Stunning Reflection of a Girl And a Secret Agent who must Succumb a Boy in A MySQL Convention,2006,1,5,4.99,47,21.99,NC-17,"Commentaries,Deleted Scenes,Behind the Scenes",12,4
607,INSTINCT AIRPORT,A Touching Documentary of a Mad Cow And a Explorer who must Confront a Butler in A Manhattan Penthouse,2006,1,4,2.99,116,21.99,PG,"Commentaries,Deleted Scenes",15,4
608,JUMANJI BLADE,A Intrepid Yarn of a Husband And a Womanizer who must Pursue a Mad Scientist in New Orleans,2006,1,4,2.99,121,13.99,G,"Commentaries,Behind the Scenes",13,4
609,NATIONAL STORY,A Taut Epistle of a Mad Scientist And a Girl who must Escape a Monkey in California,2006,1,4,2.99,92,19.99,NC-17,Trailers,6,4
610,OKLAHOMA JUMANJI,A Thoughtful Drama of a Dentist And a Womanizer who must Meet a Husband in The Sahara Desert,2006,1,7,0.99,58,15.99,PG,Behind the Scenes,13,4
611,POSEIDON FOREVER,A Thoughtful Epistle of a Womanizer And a Monkey who must Vanquish a Dentist in A Monastery,2006,1,6,4.99,159,29.99,PG-13,Commentaries,15,4
612,RAIDERS ANTITRUST,A Amazing Drama of a Teacher And a Feminist who must Meet a Woman in The First Manned Space Station,2006,1,4,0.99,82,11.99,PG-13,Deleted Scenes,6,4
613,RANDOM GO,A Fateful Drama of a Frisbee And a Student who must Confront a Cat in A Shark Tank,2006,1,6,2.99,73,29.99,NC-17,Trailers,14,4
614,REDS POCUS,A Lacklusture Yarn of a Sumo Wrestler And a Squirrel who must Redeem a Monkey in Soviet Georgia,2006,1,7,4.99,182,23.99,PG-13,"Trailers,Behind the Scenes",12,4
615,SILVERADO GOLDFINGER,A Stunning Epistle of a Sumo Wrestler And a Man who must Challenge a Waitress in Ancient India,2006,1,4,4.99,74,11.99,PG,"Trailers,Commentaries",14,4
616,SPLASH GUMP,A Taut Saga of a Crocodile And a Boat who must Conquer a Hunter in A Shark Tank,2006,1,5,0.99,175,16.99,PG,"Trailers,Commentaries,Deleted Scenes,Behind the Scenes",8,4
617,SUBMARINE BED,A Amazing Display of a Car And a Monkey who must Fight a Teacher in Soviet Georgia,2006,1,5,4.99,127,21.99,R,Trailers,5,4
618,TREASURE COMMAND,A Emotional Saga of a Car And a Madman who must Discover a Pioneer in California,2006,1,3,0.99,102,28.99,PG-13,"Trailers,Commentaries,Deleted Scenes,Behind the Scenes",11,4
619,UNFORGIVEN ZOOLANDER,A Taut Epistle of a Monkey And a Sumo Wrestler who must Vanquish a A Shark in A Baloon Factory,2006,1,7,0.99,129,15.99,PG,"Trailers,Commentaries,Behind the Scenes",14,4
620,ANALYZE HOOSIERS,A Thoughtful Display of a Explorer And a Pastry Chef who must Overcome a Feminist in The Sahara Desert,2006,1,6,2.99,181,19.99,R,"Trailers,Behind the Scenes",11,38
621,CADDYSHACK JEDI,A Awe-Inspiring Epistle of a Woman And a Madman who must Fight a Robot in Soviet Georgia,2006,1,3,0.99,52,17.99,NC-17,"Commentaries,Deleted Scenes",1,38
622,CLUB GRAFFITI,A Epic Tale of a Pioneer And a Hunter who must Escape a Girl in A U-Boat,2006,1,4,0.99,65,12.99,PG-13,"Trailers,Deleted Scenes",2,38
623,CONGENIALITY QUEST,A Touching Documentary of a Cat And a Pastry Chef who must Find a Lumberjack in A Baloon,2006,1,6,0.99,87,21.99,PG-13,"Commentaries,Behind the Scenes",15,38
624,DESIRE ALIEN,A Fast-Paced Tale of a Dog And a Forensic Psychologist who must Meet a Astronaut in The First Manned Space Station,2006,1,7,2.99,76,24.99,NC-17,Deleted Scenes,2,38
625,DONNIE ALLEY,A Awe-Inspiring Tale of a Butler And a Frisbee who must Vanquish a Teacher in Ancient Japan,2006,1,4,0.99,125,20.99,NC-17,"Trailers,Commentaries,Behind the Scenes",2,38
626,EGG IGBY,A Beautiful Documentary of a Boat And a Sumo Wrestler who must Succumb a Database Administrator in The First Manned Space Station,2006,1,4,2.99,67,20.99,PG,"Commentaries,Behind the Scenes",6,38
627,FREEDOM CLEOPATRA,A Emotional Reflection of a Dentist And a Mad Cow who must Face a Squirrel in A Baloon,2006,1,5,0.99,133,23.99,PG-13,"Trailers,Commentaries,Behind the Scenes",5,38
628,FRISCO FORREST,A Beautiful Documentary of a Woman And a Pioneer who must Pursue a Mad Scientist in A Shark Tank,2006,1,6,4.99,51,23.99,PG,"Commentaries,Deleted Scenes,Behind the Scenes",14,38
629,GENTLEMEN STAGE,A Awe-Inspiring Reflection of a Monkey And a Student who must Overcome a Dentist in The First Manned Space Station,2006,1,6,2.99,125,22.99,NC-17,"Commentaries,Deleted Scenes",9,38
630,IDAHO LOVE,A Fast-Paced Drama of a Student And a Crocodile who must Meet a Database Administrator in The Outback,2006,1,3,2.99,172,25.99,PG-13,"Trailers,Commentaries,Deleted Scenes,Behind the Scenes",13,38
631,IDOLS SNATCHERS,A Insightful Drama of a Car And a Composer who must Fight a Man in A Monastery,2006,1,5,2.99,84,29.99,NC-17,Trailers,3,38
632,INDIAN LOVE,A Insightful Saga of a Mad Scientist And a Mad Scientist who must Kill a Astronaut in An Abandoned Fun House,2006,1,4,0.99,135,26.99,NC-17,"Trailers,Commentaries,Deleted Scenes,Behind the Scenes",8,38
633,KISSING DOLLS,A Insightful Reflection of a Pioneer And a Teacher who must Build a Composer in The First Manned Space Station,2006,1,3,4.99,141,9.99,R,Trailers,1,38
634,LEGEND JEDI,A Awe-Inspiring Epistle of a Pioneer And a Student who must Outgun a Crocodile in The Outback,2006,1,7,0.99,59,18.99,PG,"Commentaries,Deleted Scenes",12,38
635,MAGIC MALLRATS,A Touching Documentary of a Pastry Chef And a Pastry Chef who must Build a Mad Scientist in California,2006,1,3,0.99,117,19.99,PG,"Trailers,Commentaries",3,38
636,MISSION ZOOLANDER,A Intrepid Story of a Sumo Wrestler And a Teacher who must Meet a A Shark in An Abandoned Fun House,2006,1,3,4.99,164,26.99,PG-13,Behind the Scenes,2,38
637,NECKLACE OUTBREAK,A Astounding Epistle of a Database Administrator And a Mad Scientist who must Pursue a Cat in California,2006,1,3,0.99,132,21.99,PG,"Trailers,Commentaries,Behind the Scenes",7,38
638,NEIGHBORS CHARADE,A Fanciful Reflection of a Crocodile And a Astronaut who must Outrace a Feminist in An Abandoned Amusement Park,2006,1,3,0.99,161,20.99,R,"Trailers,Commentaries,Deleted Scenes",15,38
639,PURPLE MOVIE,A Boring Display of a Pastry Chef And a Sumo Wrestler who must Discover a Frisbee in An Abandoned Amusement Park,2006,1,4,2.99,88,9.99,R,"Commentaries,Deleted Scenes",9,38
640,SHRUNK DIVINE,A Fateful Character Study of a Waitress And a Technical Writer who must Battle a Hunter in A Baloon,2006,1,6,2.99,139,14.99,R,"Trailers,Deleted Scenes,Behind the Scenes",1,38
641,SPICE SORORITY,A Fateful Display of a Pioneer And a Hunter who must Defeat a Husband in An Abandoned Mine Shaft,2006,1,5,4.99,141,22.99,NC-17,"Trailers,Commentaries,Deleted Scenes,Behind the Scenes",7,38
642,STALLION SUNDANCE,A Fast-Paced Tale of a Car And a Dog who must Outgun a A Shark in Australia,2006,1,5,0.99,130,23.99,PG-13,"Deleted Scenes,Behind the Scenes",14,38
643,STRANGER STRANGERS,A Awe-Inspiring Yarn of a Womanizer And a Explorer who must Fight a Woman in The First Manned Space Station,2006,1,3,4.99,139,12.99,G,"Commentaries,Deleted Scenes",3,38
644,TARZAN VIDEOTAPE,A Fast-Paced Display of a Lumberjack And a Mad Scientist who must Succumb a Sumo Wrestler in The Sahara Desert,2006,1,3,2.99,91,11.99,PG-13,Trailers,11,38
645,ANGELS LIFE,A Thoughtful Display of a Woman And a Astronaut who must Battle a Robot in Berlin,2006,1,3,2.99,74,15.99,G,Trailers,13,7
646,ANONYMOUS HUMAN,A Amazing Reflection of a Database Administrator And a Astronaut who must Outrace a Database Administrator in A Shark Tank,2006,1,7,0.99,179,12.99,NC-17,"Deleted Scenes,Behind the Scenes",15,7
647,ARACHNOPHOBIA ROLLERCOASTER,A Action-Packed Reflection of a Pastry Chef And a Composer who must Discover a Mad Scientist in The First Manned Space Station,2006,1,4,2.99,147,24.99,PG-13,"Trailers,Deleted Scenes,Behind the Scenes",11,7
648,BERETS AGENT,A Taut Saga of a Crocodile And a Boy who must Overcome a Technical Writer in Ancient China,2006,1,5,2.99,77,24.99,PG-13,Deleted Scenes,1,7
649,BREAKING HOME,A Beautiful Display of a Secret Agent And a Monkey who must Battle a Sumo Wrestler in An Abandoned Mine Shaft,2006,1,4,2.99,169,21.99,PG-13,"Trailers,Commentaries",13,7
650,COMMAND DARLING,A Awe-Inspiring Tale of a Forensic Psychologist And a Woman who must Challenge a Database Administrator in Ancient Japan,2006,1,5,4.99,120,28.99,PG-13,Behind the Scenes,9,7
651,CONFESSIONS MAGUIRE,A Insightful Story of a Car And a Boy who must Battle a Technical Writer in A Baloon,2006,1,7,4.99,65,25.99,PG-13,Behind the Scenes,7,7
652,DAZED PUNK,A Action-Packed Story of a Pioneer And a Technical Writer who must Discover a Forensic Psychologist in An Abandoned Amusement Park,2006,1,6,4.99,120,20.99,G,"Commentaries,Deleted Scenes",10,7
653,DECEIVER BETRAYED,A Taut Story of a Moose And a Squirrel who must Build a Husband in Ancient India,2006,1,7,0.99,122,22.99,NC-17,"Trailers,Commentaries,Deleted Scenes,Behind the Scenes",7,7
654,DESTINATION JERK,A Beautiful Yarn of a Teacher And a Cat who must Build a Car in A U-Boat,2006,1,3,0.99,76,19.99,PG-13,"Trailers,Commentaries,Behind the Scenes",7,7
655,EXCITEMENT EVE,A Brilliant Documentary of a Monkey And a Car who must Conquer a Crocodile in A Shark Tank,2006,1,3,0.99,51,20.99,G,Commentaries,1,7
656,GASLIGHT CRUSADE,A Amazing Epistle of a Boy And a Astronaut who must Redeem a Man in The Gulf of Mexico,2006,1,4,2.99,106,10.99,PG,"Trailers,Deleted Scenes",11,7
657,HELLFIGHTERS SIERRA,A Taut Reflection of a A Shark And a Dentist who must Battle a Boat in Soviet Georgia,2006,1,3,2.99,75,23.99,PG,"Deleted Scenes,Behind the Scenes",9,7
658,INSTINCT AIRPORT,A Touching Documentary of a Mad Cow And a Explorer who must Confront a Butler in A Manhattan Penthouse,2006,1,4,2.99,116,21.99,PG,"Commentaries,Deleted Scenes",15,7
659,MALKOVICH PET,A Intrepid Reflection of a Waitress And a A Shark who must Kill a Squirrel in The Outback,2006,1,6,2.99,159,22.99,G,Behind the Scenes,4,7
660,NECKLACE OUTBREAK,A Astounding Epistle of a Database Administrator And a Mad Scientist who must Pursue a Cat in California,2006,1,3,0.99,132,21.99,PG,"Trailers,Commentaries,Behind the Scenes",7,7
661,OCTOBER SUBMARINE,A Taut Epistle of a Monkey And a Boy who must Confront a Husband in A Jet Boat,2006,1,6,4.99,54,10.99,PG-13,"Trailers,Commentaries,Behind the Scenes",4,7
662,OPEN AFRICAN,A Lacklusture Drama of a Secret Agent And a Explorer who must Discover a Car in A U-Boat,2006,1,7,4.99,131,16.99,PG,"Trailers,Commentaries",14,7
663,POSEIDON FOREVER,A Thoughtful Epistle of a Womanizer And a Monkey who must Vanquish a Dentist in A Monastery,2006,1,6,4.99,159,29.99,PG-13,Commentaries,15,7
664,SAINTS BRIDE,A Fateful Tale of a Technical Writer And a Composer who must Pursue a Explorer in The Gulf of Mexico,2006,1,5,2.99,125,11.99,G,Deleted Scenes,7,7
665,SAVANNAH TOWN,A Awe-Inspiring Tale of a Astronaut And a Database Administrator who must Chase a Secret Agent in The Gulf of Mexico,2006,1,5,0.99,84,25.99,PG-13,"Commentaries,Deleted Scenes,Behind the Scenes",7,7
666,SCISSORHANDS SLUMS,A Awe-Inspiring Drama of a Girl And a Technical Writer who must Meet a Feminist in The Canadian Rockies,2006,1,5,2.99,147,13.99,G,"Commentaries,Deleted Scenes,Behind the Scenes",9,7
667,SLEEPLESS MONSOON,A Amazing Saga of a Moose And a Pastry Chef who must Escape a Butler in Australia,2006,1,5,4.99,64,12.99,G,"Trailers,Deleted Scenes,Behind the Scenes",2,7
668,SLEEPY JAPANESE,A Emotional Epistle of a Moose And a Composer who must Fight a Technical Writer in The Outback,2006,1,4,2.99,137,25.99,PG,"Trailers,Commentaries,Deleted Scenes",13,7
669,STING PERSONAL,A Fanciful Drama of a Frisbee And a Dog who must Fight a Madman in A Jet Boat,2006,1,3,4.99,93,9.99,NC-17,"Commentaries,Deleted Scenes,Behind the Scenes",13,7
670,TOWN ARK,A Awe-Inspiring Documentary of a Moose And a Madman who must Meet a Dog in An Abandoned Mine Shaft,2006,1,6,2.99,136,17.99,R,Behind the Scenes,9,7
671,TRACY CIDER,A Touching Reflection of a Database Administrator And a Madman who must Build a Lumberjack in Nigeria,2006,1,3,0.99,142,29.99,G,"Trailers,Commentaries,Behind the Scenes",2,7
672,TREATMENT JEKYLL,A Boring Story of a Teacher And a Student who must Outgun a Cat in An Abandoned Mine Shaft,2006,1,3,0.99,87,19.99,PG,"Trailers,Deleted Scenes,Behind the Scenes",7,7
673,WAR NOTTING,A Boring Drama of a Teacher And a Sumo Wrestler who must Challenge a Secret Agent in The Canadian Rockies,2006,1,7,4.99,80,26.99,G,"Deleted Scenes,Behind the Scenes",9,7
674,WARLOCK WEREWOLF,A Astounding Yarn of a Pioneer And a Crocodile who must Defeat a A Shark in The Outback,2006,1,6,2.99,83,10.99,G,"Commentaries,Behind the Scenes",3,7
675,ANTITRUST TOMATOES,A Fateful Yarn of a Womanizer And a Feminist who must Succumb a Database Administrator in Ancient India,2006,1,5,2.99,168,11.99,NC-17,"Trailers,Commentaries,Deleted Scenes",1,6
676,BANG KWAI,A Epic Drama of a Madman And a Cat who must Face a A Shark in An Abandoned Amusement Park,2006,1,5,2.99,87,25.99,NC-17,"Commentaries,Deleted Scenes,Behind the Scenes",8,6
677,BEAST HUNCHBACK,A Awe-Inspiring Epistle of a Student And a Squirrel who must Defeat a Boy in Ancient China,2006,1,3,4.99,89,22.99,R,"Deleted Scenes,Behind the Scenes",4,6
678,BIKINI BORROWERS,A Astounding Drama of a Astronaut And a Cat who must Discover a Woman in The First Manned Space Station,2006,1,7,4.99,142,26.99,NC-17,"Commentaries,Deleted Scenes",2,6
679,CALENDAR GUNFIGHT,A Thrilling Drama of a Frisbee And a Lumberjack who must Sink a Man in Nigeria,2006,1,4,4.99,120,22.99,NC-17,"Trailers,Commentaries,Behind the Scenes",9,6
680,COAST RAINBOW,A Astounding Documentary of a Mad Cow And a Pioneer who must Challenge a Butler in The Sahara Desert,2006,1,4,0.99,55,20.99,PG,"Trailers,Commentaries,Deleted Scenes,Behind the Scenes",6,6
681,COLDBLOODED DARLING,A Brilliant Panorama of a Dentist And a Moose who must Find a Student in The Gulf of Mexico,2006,1,7,4.99,70,27.99,G,"Trailers,Deleted Scenes",14,6
682,CROSSROADS CASUALTIES,A Intrepid Documentary of a Sumo Wrestler And a Astronaut who must Battle a Composer in The Outback,2006,1,5,2.99,153,20.99,G,"Trailers,Commentaries,Behind the Scenes",2,6
683,DROP WATERFRONT,A Fanciful Documentary of a Husband And a Explorer who must Reach a Madman in Ancient China,2006,1,6,4.99,178,20.99,R,"Trailers,Commentaries",15,6
684,IGBY MAKER,A Epic Documentary of a Hunter And a Dog who must Outgun a Dog in A Baloon Factory,2006,1,7,4.99,160,12.99,NC-17,"Trailers,Behind the Scenes",16,6
685,KRAMER CHOCOLATE,A Amazing Yarn of a Robot And a Pastry Chef who must Redeem a Mad Scientist in The Outback,2006,1,3,2.99,171,24.99,R,Trailers,15,6
686,LANGUAGE COWBOY,A Epic Yarn of a Cat And a Madman who must Vanquish a Dentist in An Abandoned Amusement Park,2006,1,5,0.99,78,26.99,NC-17,"Trailers,Deleted Scenes",3,6
687,LESSON CLEOPATRA,A Emotional Display of a Man And a Explorer who must Build a Boy in A Manhattan Penthouse,2006,1,3,0.99,167,28.99,NC-17,"Deleted Scenes,Behind the Scenes",15,6
688,LIBERTY MAGNIFICENT,A Boring Drama of a Student And a Cat who must Sink a Technical Writer in A Baloon,2006,1,3,2.99,138,27.99,G,"Commentaries,Deleted Scenes,Behind the Scenes",15,6
689,MULHOLLAND BEAST,A Awe-Inspiring Display of a Husband And a Squirrel who must Battle a Sumo Wrestler in A Jet Boat,2006,1,7,2.99,157,13.99,PG,"Trailers,Deleted Scenes,Behind the Scenes",9,6
690,POTLUCK MIXED,A Beautiful Story of a Dog And a Technical Writer who must Outgun a Student in A Baloon,2006,1,3,2.99,179,10.99,G,Behind the Scenes,2,6
691,SPEED SUIT,A Brilliant Display of a Frisbee And a Mad Scientist who must Succumb a Robot in Ancient China,2006,1,7,4.99,124,19.99,PG-13,"Commentaries,Behind the Scenes",16,6
692,TITANIC BOONDOCK,A Brilliant Reflection of a Feminist And a Dog who must Fight a Boy in A Baloon Factory,2006,1,3,4.99,104,18.99,R,"Trailers,Commentaries,Deleted Scenes,Behind the Scenes",2,6
693,TRADING PINOCCHIO,A Emotional Character Study of a Student And a Explorer who must Discover a Frisbee in The First Manned Space Station,2006,1,6,4.99,170,22.99,PG,"Trailers,Deleted Scenes,Behind the Scenes",15,6
694,WYOMING STORM,A Awe-Inspiring Panorama of a Robot And a Boat who must Overcome a Feminist in A U-Boat,2006,1,6,4.99,100,29.99,PG-13,Deleted Scenes,13,6
695,ANYTHING SAVANNAH,A Epic Story of a Pastry Chef And a Woman who must Chase a Feminist in An Abandoned Fun House,2006,1,4,2.99,82,27.99,R,"Trailers,Deleted Scenes,Behind the Scenes",11,9
696,BIRCH ANTITRUST,A Fanciful Panorama of a Husband And a Pioneer who must Outgun a Dog in A Baloon,2006,1,4,4.99,162,18.99,PG,"Trailers,Commentaries,Deleted Scenes",12,9
697,CHOCOLAT HARRY,A Action-Packed Epistle of a Dentist And a Moose who must Meet a Mad Cow in Ancient Japan,2006,1,5,0.99,101,16.99,NC-17,"Commentaries,Behind the Scenes",8,9
698,CHOCOLATE DUCK,A Unbelieveable Story of a Mad Scientist And a Technical Writer who must Discover a Composer in Ancient China,2006,1,3,2.99,132,13.99,R,"Trailers,Commentaries,Behind the Scenes",9,9
699,CROOKED FROGMEN,A Unbelieveable Drama of a Hunter And a Database Administrator who must Battle a Crocodile in An Abandoned Amusement Park,2006,1,6,0.99,143,27.99,PG-13,"Commentaries,Deleted Scenes,Behind the Scenes",3,9
700,CURTAIN VIDEOTAPE,A Boring Reflection of a Dentist And a Mad Cow who must Chase a Secret Agent in A Shark Tank,2006,1,7,0.99,133,27.99,PG-13,"Trailers,Commentaries,Deleted Scenes,Behind the Scenes",10,9
701,DALMATIONS SWEDEN,A Emotional Epistle of a Moose And a Hunter who must Overcome a Robot in A Manhattan Penthouse,2006,1,4,0.99,106,25.99,PG,"Trailers,Commentaries,Deleted Scenes",7,9
702,HORROR REIGN,A Touching Documentary of a A Shark And a Car who must Build a Husband in Nigeria,2006,1,3,0.99,139,25.99,R,"Deleted Scenes,Behind the Scenes",16,9
703,LAWLESS VISION,A Insightful Yarn of a Boy And a Sumo Wrestler who must Outgun a Car in The Outback,2006,1,6,4.99,181,29.99,G,"Deleted Scenes,Behind the Scenes",2,9
704,LEBOWSKI SOLDIERS,A Beautiful Epistle of a Secret Agent And a Pioneer who must Chase a Astronaut in Ancient China,2006,1,6,2.99,69,17.99,PG-13,"Commentaries,Deleted Scenes",7,9
705,MAJESTIC FLOATS,A Thrilling Character Study of a Moose And a Student who must Escape a Butler in The First Manned Space Station,2006,1,5,0.99,130,15.99,PG,Trailers,6,9
706,PACIFIC AMISTAD,A Thrilling Yarn of a Dog And a Moose who must Kill a Pastry Chef in A Manhattan Penthouse,2006,1,3,0.99,144,27.99,G,"Trailers,Commentaries,Deleted Scenes,Behind the Scenes",6,9
707,PERDITION FARGO,A Fast-Paced Story of a Car And a Cat who must Outgun a Hunter in Berlin,2006,1,7,4.99,99,27.99,NC-17,"Trailers,Behind the Scenes",15,9
708,PRIMARY GLASS,A Fateful Documentary of a Pastry Chef And a Butler who must Build a Dog in The Canadian Rockies,2006,1,7,0.99,53,16.99,G,"Trailers,Deleted Scenes,Behind the Scenes",1,9
709,REEF SALUTE,A Action-Packed Saga of a Teacher And a Lumberjack who must Battle a Dentist in A Baloon,2006,1,5,0.99,123,26.99,NC-17,Behind the Scenes,11,9
710,RUNNER MADIGAN,A Thoughtful Documentary of a Crocodile And a Robot who must Outrace a Womanizer in The Outback,2006,1,6,0.99,101,27.99,NC-17,"Commentaries,Deleted Scenes,Behind the Scenes",12,9
711,SMILE EARRING,A Intrepid Drama of a Teacher And a Butler who must Build a Pastry Chef in Berlin,2006,1,4,2.99,60,29.99,G,"Commentaries,Behind the Scenes",16,9
712,SNATCHERS MONTEZUMA,A Boring Epistle of a Sumo Wrestler And a Woman who must Escape a Man in The Canadian Rockies,2006,1,4,2.99,74,14.99,PG-13,Commentaries,4,9
713,SUNRISE LEAGUE,A Beautiful Epistle of a Madman And a Butler who must Face a Crocodile in A Manhattan Penthouse,2006,1,3,4.99,135,19.99,PG-13,Behind the Scenes,2,9
714,SWEETHEARTS SUSPECTS,A Brilliant Character Study of a Frisbee And a Sumo Wrestler who must Confront a Woman in The Gulf of Mexico,2006,1,3,0.99,108,13.99,G,"Trailers,Commentaries,Deleted Scenes,Behind the Scenes",3,9
715,TIES HUNGER,A Insightful Saga of a Astronaut And a Explorer who must Pursue a Mad Scientist in A U-Boat,2006,1,3,4.99,111,28.99,R,Deleted Scenes,3,9
716,TRAFFIC HOBBIT,A Amazing Epistle of a Squirrel And a Lumberjack who must Succumb a Database Administrator in A U-Boat,2006,1,5,4.99,139,13.99,G,"Trailers,Commentaries",16,9
717,UNTOUCHABLES SUNRISE,A Amazing Documentary of a Woman And a Astronaut who must Outrace a Teacher in An Abandoned Fun House,2006,1,5,2.99,120,11.99,NC-17,"Trailers,Deleted Scenes",6,9
718,WATERFRONT DELIVERANCE,A Unbelieveable Documentary of a Dentist And a Technical Writer who must Build a Womanizer in Nigeria,2006,1,4,4.99,61,17.99,G,Behind the Scenes,1,9
719,WILD APOLLO,A Beautiful Story of a Monkey And a Sumo Wrestler who must Conquer a A Shark in A MySQL Convention,2006,1,4,0.99,181,24.99,R,"Trailers,Commentaries,Deleted Scenes,Behind the Scenes",13,9
720,APACHE DIVINE,A Awe-Inspiring Reflection of a Pastry Chef And a Teacher who must Overcome a Sumo Wrestler in A U-Boat,2006,1,5,4.99,92,16.99,NC-17,"Commentaries,Deleted Scenes,Behind the Scenes",8,15
721,BORROWERS BEDAZZLED,A Brilliant Epistle of a Teacher And a Sumo Wrestler who must Defeat a Man in An Abandoned Fun House,2006,1,7,0.99,63,22.99,G,"Commentaries,Deleted Scenes,Behind the Scenes",2,15
