film_id,title,description,release_year,language_id,rental_duration,rental_rate,length,replacement_cost,rating,special_features,category_id,actor_id
290,BULL SHAWSHANK,A Fanciful Drama of a Moose And a Squirrel who must Conquer a Pioneer in The Canadian Rockies,2006,1,6,0.99,125,21.99,NC-17,Deleted Scenes,1,29
291,CABIN FLASH,A Stunning Epistle of a Boat And a Man who must Challenge a A Shark in A Baloon Factory,2006,1,4,0.99,53,25.99,NC-17,"Commentaries,Deleted Scenes",3,29
292,CENTER DINOSAUR,A Beautiful Character Study of a Sumo Wrestler And a Dentist who must Find a Dog in California,2006,1,5,4.99,152,12.99,PG,Deleted Scenes,4,29
293,CHAMBER ITALIAN,A Fateful Reflection of a Moose And a Husband who must Overcome a Monkey in Nigeria,2006,1,7,4.99,117,14.99,NC-17,Trailers,12,29
294,CONEHEADS SMOOCHY,A Touching Story of a Womanizer And a Composer who must Pursue a Husband in Nigeria,2006,1,7,4.99,112,12.99,NC-17,"Deleted Scenes,Behind the Scenes",7,29
295,DESTINY SATURDAY,A Touching Drama of a Crocodile And a Crocodile who must Conquer a Explorer in Soviet Georgia,2006,1,4,4.99,56,20.99,G,"Trailers,Commentaries,Behind the Scenes",13,29
296,EFFECT GLADIATOR,A Beautiful Display of a Pastry Chef And a Pastry Chef who must Outgun a Forensic Psychologist in A Manhattan Penthouse,2006,1,6,0.99,107,14.99,PG,Commentaries,8,29
297,ENCOUNTERS CURTAIN,A Insightful Epistle of a Pastry Chef And a Womanizer who must Build a Boat in New Orleans,2006,1,5,0.99,92,20.99,NC-17,Trailers,7,29
298,EXPRESS LONELY,A Boring Drama of a Astronaut And a Boat who must Face a Boat in California,2006,1,5,2.99,178,23.99,R,Trailers,14,29
299,FICTION CHRISTMAS,A Emotional Yarn of a A Shark And a Student who must Battle a Robot in An Abandoned Mine Shaft,2006,1,4,0.99,72,14.99,PG,"Trailers,Commentaries,Deleted Scenes,Behind the Scenes",9,29
300,FREEDOM CLEOPATRA,A Emotional Reflection of a Dentist And a Mad Cow who must Face a Squirrel in A Baloon,2006,1,5,0.99,133,23.99,PG-13,"Trailers,Commentaries,Behind the Scenes",5,29
301,FUGITIVE MAGUIRE,A Taut Epistle of a Feminist And a Sumo Wrestler who must Battle a Crocodile in Australia,2006,1,7,4.99,83,28.99,R,"Trailers,Commentaries,Deleted Scenes",16,29
302,HOURS RAGE,A Fateful Story of a Explorer And a Feminist who must Meet a Technical Writer in Soviet Georgia,2006,1,4,0.99,122,14.99,NC-17,"Trailers,Deleted Scenes",13,29
303,HUSTLER PARTY,A Emotional Reflection of a Sumo Wrestler And a Monkey who must Conquer a Robot in The Sahara Desert,2006,1,3,4.99,83,22.99,NC-17,"Trailers,Commentaries,Behind the Scenes",5,29
304,IDENTITY LOVER,A Boring Tale of a Composer And a Mad Cow who must Defeat a Car in The Outback,2006,1,4,2.99,119,12.99,PG-13,Deleted Scenes,14,29
305,INSIDER ARIZONA,A Astounding Saga of a Mad Scientist And a Hunter who must Pursue a Robot in A Baloon Factory,2006,1,5,2.99,78,17.99,NC-17,Commentaries,12,29
306,JEOPARDY ENCINO,A Boring Panorama of a Man And a Mad Cow who must Face a Explorer in Ancient India,2006,1,3,0.99,102,12.99,R,"Trailers,Commentaries",4,29
307,JOON NORTHWEST,A Thrilling Panorama of a Technical Writer And a Car who must Discover a Forensic Psychologist in A Shark Tank,2006,1,3,0.99,105,23.99,NC-17,"Trailers,Commentaries,Behind the Scenes",15,29
308,LIBERTY MAGNIFICENT,A Boring Drama of a Student And a Cat who must Sink a Technical Writer in A Baloon,2006,1,3,2.99,138,27.99,G,"Commentaries,Deleted Scenes,Behind the Scenes",15,29
309,MAGIC MALLRATS,A Touching Documentary of a Pastry Chef And a Pastry Chef who must Build a Mad Scientist in California,2006,1,3,0.99,117,19.99,PG,"Trailers,Commentaries",3,29
310,MONEY HAROLD,A Touching Tale of a Explorer And a Boat who must Defeat a Robot in Australia,2006,1,3,2.99,135,17.99,PG,"Trailers,Commentaries",13,29
311,OUTBREAK DIVINE,A Unbelieveable Yarn of a Database Administrator And a Woman who must Succumb a A Shark in A U-Boat,2006,1,6,0.99,169,12.99,NC-17,"Trailers,Deleted Scenes,Behind the Scenes",10,29
312,REIGN GENTLEMEN,A Emotional Yarn of a Composer And a Man who must Escape a Butler in The Gulf of Mexico,2006,1,3,2.99,82,29.99,PG-13,"Deleted Scenes,Behind the Scenes",14,29
313,SMOKING BARBARELLA,A Lacklusture Saga of a Mad Cow And a Mad Scientist who must Sink a Cat in A MySQL Convention,2006,1,7,0.99,50,13.99,PG-13,Behind the Scenes,6,29
314,SUMMER SCARFACE,A Emotional Panorama of a Lumberjack And a Hunter who must Meet a Girl in A Shark Tank,2006,1,5,0.99,53,25.99,G,"Deleted Scenes,Behind the Scenes",4,29
315,UPTOWN YOUNG,A Fateful Documentary of a Dog And a Hunter who must Pursue a Teacher in An Abandoned Amusement Park,2006,1,5,2.99,84,16.99,PG,Commentaries,3,29
316,VIRGIN DAISY,A Awe-Inspiring Documentary of a Robot And a Mad Scientist who must Reach a Database Administrator in A Shark Tank,2006,1,6,4.99,179,29.99,PG-13,"Trailers,Behind the Scenes",7,29
317,ALADDIN CALENDAR,A Action-Packed Tale of a Man And a Lumberjack who must Reach a Feminist in Ancient China,2006,1,6,4.99,63,24.99,NC-17,"Trailers,Deleted Scenes",15,35
318,ARACHNOPHOBIA ROLLERCOASTER,A Action-Packed Reflection of a Pastry Chef And a Composer who must Discover a Mad Scientist in The First Manned Space Station,2006,1,4,2.99,147,24.99,PG-13,"Trailers,Deleted Scenes,Behind the Scenes",11,35
319,BALLROOM MOCKINGBIRD,A Thrilling Documentary of a Composer And a Monkey who must Find a Feminist in California,2006,1,6,0.99,173,29.99,G,"Commentaries,Deleted Scenes",9,35
320,CYCLONE FAMILY,A Lacklusture Drama of a Student And a Monkey who must Sink a Womanizer in A MySQL Convention,2006,1,7,2.99,176,18.99,PG,"Trailers,Deleted Scenes",9,35
321,DROP WATERFRONT,A Fanciful Documentary of a Husband And a Explorer who must Reach a Madman in Ancient China,2006,1,6,4.99,178,20.99,R,"Trailers,Commentaries",15,35
322,GUNFIGHTER MUSSOLINI,A Touching Saga of a Robot And a Boy who must Kill a Man in Ancient Japan,2006,1,3,2.99,127,9.99,PG-13,"Trailers,Commentaries",15,35
323,MODERN DORADO,A Awe-Inspiring Story of a Butler And a Sumo Wrestler who must Redeem a Boy in New Orleans,2006,1,3,0.99,74,20.99,PG,"Trailers,Commentaries,Deleted Scenes",6,35
324,MUSSOLINI SPOILERS,A Thrilling Display of a Boat And a Monkey who must Meet a Composer in Ancient China,2006,1,6,2.99,180,10.99,G,"Deleted Scenes,Behind the Scenes",15,35
325,NASH CHOCOLAT,A Epic Reflection of a Monkey And a Mad Cow who must Kill a Forensic Psychologist in An Abandoned Mine Shaft,2006,1,6,2.99,180,21.99,PG-13,"Commentaries,Behind the Scenes",2,35
326,QUEST MUSSOLINI,A Fateful Drama of a Husband And a Sumo Wrestler who must Battle a Pastry Chef in A Baloon Factory,2006,1,5,2.99,177,29.99,R,Behind the Scenes,1,35
327,RINGS HEARTBREAKERS,A Amazing Yarn of a Sumo Wrestler And a Boat who must Conquer a Waitress in New Orleans,2006,1,5,0.99,58,17.99,G,"Trailers,Commentaries,Behind the Scenes",1,35
328,ROCKETEER MOTHER,A Awe-Inspiring Character Study of a Robot And a Sumo Wrestler who must Discover a Womanizer in A Shark Tank,2006,1,3,0.99,178,27.99,PG-13,"Deleted Scenes,Behind the Scenes",9,35
329,RUGRATS SHAKESPEARE,A Touching Saga of a Crocodile And a Crocodile who must Discover a Technical Writer in Nigeria,2006,1,4,0.99,109,16.99,PG-13,"Trailers,Commentaries,Deleted Scenes,Behind the Scenes",1,35
330,SOLDIERS EVOLUTION,A Lacklusture Panorama of a A Shark And a Pioneer who must Confront a Student in The First Manned Space Station,2006,1,7,4.99,185,27.99,R,"Trailers,Commentaries,Deleted Scenes,Behind the Scenes",14,35
331,TROUBLE DATE,A Lacklusture Panorama of a Forensic Psychologist And a Woman who must Kill a Explorer in Ancient Japan,2006,1,6,2.99,61,13.99,PG,"Trailers,Commentaries,Behind the Scenes",16,35
332,ALADDIN CALENDAR,A Action-Packed Tale of a Man And a Lumberjack who must Reach a Feminist in Ancient China,2006,1,6,4.99,63,24.99,NC-17,"Trailers,Deleted Scenes",15,37
333,ALASKA PHANTOM,A Fanciful Saga of a Hunter And a Pastry Chef who must Vanquish a Boy in Australia,2006,1,6,0.99,136,22.99,PG,"Commentaries,Deleted Scenes",12,37
334,AMADEUS HOLY,A Emotional Display of a Pioneer And a Technical Writer who must Battle a Man in A Baloon,2006,1,6,0.99,113,20.99,PG,"Commentaries,Deleted Scenes,Behind the Scenes",1,37
335,CANYON STOCK,A Thoughtful Reflection of a Waitress And a Feminist who must Escape a Squirrel in A Manhattan Penthouse,2006,1,7,0.99,85,26.99,R,"Trailers,Deleted Scenes",2,37
336,CAPER MOTIONS,A Fateful Saga of a Moose And a Car who must Pursue a Woman in A MySQL Convention,2006,1,6,0.99,176,22.99,G,"Trailers,Commentaries,Deleted Scenes",5,37
337,CARRIE BUNCH,A Amazing Epistle of a Student And a Astronaut who must Discover a Frisbee in The Canadian Rockies,2006,1,7,0.99,114,11.99,PG,"Trailers,Commentaries,Behind the Scenes",11,37
338,CHITTY LOCK,A Boring Epistle of a Boat And a Database Administrator who must Kill a Sumo Wrestler in The First Manned Space Station,2006,1,6,2.99,107,24.99,G,Commentaries,7,37
339,DALMATIONS SWEDEN,A Emotional Epistle of a Moose And a Hunter who must Overcome a Robot in A Manhattan Penthouse,2006,1,4,0.99,106,25.99,PG,"Trailers,Commentaries,Deleted Scenes",7,37
340,DRIFTER COMMANDMENTS,A Epic Reflection of a Womanizer And a Squirrel who must Discover a Husband in A Jet Boat,2006,1,5,4.99,61,18.99,PG-13,"Trailers,Behind the Scenes",1,37
341,DUDE BLINDNESS,A Stunning Reflection of a Husband And a Lumberjack who must Face a Frisbee in An Abandoned Fun House,2006,1,3,4.99,132,9.99,G,"Trailers,Deleted Scenes",15,37
342,ELEPHANT TROJAN,A Beautiful Panorama of a Lumberjack And a Forensic Psychologist who must Overcome a Frisbee in A Baloon,2006,1,4,4.99,126,24.99,PG-13,Behind the Scenes,11,37
343,FIREBALL PHILADELPHIA,A Amazing Yarn of a Dentist And a A Shark who must Vanquish a Madman in An Abandoned Mine Shaft,2006,1,4,0.99,148,25.99,PG,"Trailers,Commentaries,Behind the Scenes",5,37
344,INTRIGUE WORST,A Fanciful Character Study of a Explorer And a Mad Scientist who must Vanquish a Squirrel in A Jet Boat,2006,1,6,0.99,181,10.99,G,Deleted Scenes,9,37
345,JAWBREAKER BROOKLYN,A Stunning Reflection of a Boat And a Pastry Chef who must Succumb a A Shark in A Jet Boat,2006,1,5,0.99,118,15.99,PG,"Trailers,Behind the Scenes",12,37
346,JERSEY SASSY,A Lacklusture Documentary of a Madman And a Mad Cow who must Find a Feminist in Ancient Japan,2006,1,6,4.99,60,16.99,PG,"Deleted Scenes,Behind the Scenes",3,37
347,LAMBS CINCINATTI,A Insightful Story of a Man And a Feminist who must Fight a Composer in Australia,2006,1,6,4.99,144,18.99,PG-13,"Trailers,Behind the Scenes",10,37
348,LONELY ELEPHANT,A Intrepid Story of a Student And a Dog who must Challenge a Explorer in Soviet Georgia,2006,1,3,2.99,67,12.99,G,"Trailers,Commentaries,Deleted Scenes,Behind the Scenes",5,37
349,MAKER GABLES,A Stunning Display of a Moose And a Database Administrator who must Pursue a Composer in A Jet Boat,2006,1,4,0.99,136,12.99,PG-13,"Deleted Scenes,Behind the Scenes",3,37
350,MALLRATS UNITED,A Thrilling Yarn of a Waitress And a Dentist who must Find a Hunter in A Monastery,2006,1,4,0.99,133,25.99,PG,"Trailers,Commentaries,Deleted Scenes",5,37
351,METROPOLIS COMA,A Emotional Saga of a Database Administrator And a Pastry Chef who must Confront a Teacher in A Baloon Factory,2006,1,4,2.99,64,9.99,PG-13,"Trailers,Commentaries,Behind the Scenes",14,37
352,MODEL FISH,A Beautiful Panorama of a Boat And a Crocodile who must Outrace a Dog in Australia,2006,1,4,4.99,175,11.99,NC-17,"Trailers,Commentaries,Behind the Scenes",3,37
353,PATHS CONTROL,A Astounding Documentary of a Butler And a Cat who must Find a Frisbee in Ancient China,2006,1,3,4.99,118,9.99,PG,"Trailers,Behind the Scenes",7,37
354,PATIENT SISTER,A Emotional Epistle of a Squirrel And a Robot who must Confront a Lumberjack in Soviet Georgia,2006,1,7,0.99,99,29.99,NC-17,"Trailers,Commentaries",4,37
355,PREJUDICE OLEANDER,A Epic Saga of a Boy And a Dentist who must Outrace a Madman in A U-Boat,2006,1,6,4.99,98,15.99,PG-13,"Trailers,Commentaries,Deleted Scenes",4,37
356,PRIMARY GLASS,A Fateful Documentary of a Pastry Chef And a Butler who must Build a Dog in The Canadian Rockies,2006,1,7,0.99,53,16.99,G,"Trailers,Deleted Scenes,Behind the Scenes",1,37
357,SHAWSHANK BUBBLE,A Lacklusture Story of a Moose And a Monkey who must Confront a Butler in An Abandoned Amusement Park,2006,1,6,4.99,80,20.99,PG,"Commentaries,Deleted Scenes",16,37
358,STALLION SUNDANCE,A Fast-Paced Tale of a Car And a Dog who must Outgun a A Shark in Australia,2006,1,5,0.99,130,23.99,PG-13,"Deleted Scenes,Behind the Scenes",14,37
359,STAMPEDE DISTURBING,A Unbelieveable Tale of a Woman And a Lumberjack who must Fight a Frisbee in A U-Boat,2006,1,5,0.99,75,26.99,R,"Commentaries,Deleted Scenes,Behind the Scenes",10,37
360,STRANGER STRANGERS,A Awe-Inspiring Yarn of a Womanizer And a Explorer who must Fight a Woman in The First Manned Space Station,2006,1,3,4.99,139,12.99,G,"Commentaries,Deleted Scenes",3,37
361,TOWN ARK,A Awe-Inspiring Documentary of a Moose And a Madman who must Meet a Dog in An Abandoned Mine Shaft,2006,1,6,2.99,136,17.99,R,Behind the Scenes,9,37
362,UNITED PILOT,A Fast-Paced Reflection of a Cat And a Mad Cow who must Fight a Car in The Sahara Desert,2006,1,3,0.99,164,27.99,R,"Trailers,Deleted Scenes",6,37
363,WATCH TRACY,A Fast-Paced Yarn of a Dog And a Frisbee who must Conquer a Hunter in Nigeria,2006,1,5,0.99,78,12.99,PG,"Trailers,Deleted Scenes,Behind the Scenes",2,37
364,WEDDING APOLLO,A Action-Packed Tale of a Student And a Waitress who must Conquer a Lumberjack in An Abandoned Mine Shaft,2006,1,3,0.99,70,14.99,PG,Trailers,6,37
365,WORKING MICROCOSMOS,A Stunning Epistle of a Dentist And a Dog who must Kill a Madman in Ancient China,2006,1,4,4.99,74,22.99,R,"Commentaries,Deleted Scenes",16,37
366,YOUTH KICK,A Touching Drama of a Teacher And a Cat who must Challenge a Technical Writer in A U-Boat,2006,1,4,0.99,179,14.99,NC-17,"Trailers,Behind the Scenes",12,37
367,ALICE FANTASIA,A Emotional Drama of a A Shark And a Database Administrator who must Vanquish a Pioneer in Soviet Georgia,2006,1,6,0.99,94,23.99,NC-17,"Trailers,Deleted Scenes,Behind the Scenes",4,28
368,ATLANTIS CAUSE,A Thrilling Yarn of a Feminist And a Hunter who must Fight a Technical Writer in A Shark Tank,2006,1,6,2.99,170,15.99,G,Behind the Scenes,8,28
369,BEACH HEARTBREAKERS,A Fateful Display of a Womanizer And a Mad Scientist who must Outgun a A Shark in Soviet Georgia,2006,1,6,2.99,122,16.99,G,"Deleted Scenes,Behind the Scenes",6,28
370,BIRCH ANTITRUST,A Fanciful Panorama of a Husband And a Pioneer who must Outgun a Dog in A Baloon,2006,1,4,4.99,162,18.99,PG,"Trailers,Commentaries,Deleted Scenes",12,28
371,BREAKING HOME,A Beautiful Display of a Secret Agent And a Monkey who must Battle a Sumo Wrestler in An Abandoned Mine Shaft,2006,1,4,2.99,169,21.99,PG-13,"Trailers,Commentaries",13,28
372,BUNCH MINDS,A Emotional Story of a Feminist And a Feminist who must Escape a Pastry Chef in A MySQL Convention,2006,1,4,2.99,63,13.99,G,Behind the Scenes,7,28
373,DUCK RACER,A Lacklusture Yarn of a Teacher And a Squirrel who must Overcome a Dog in A Shark Tank,2006,1,4,2.99,116,15.99,NC-17,Behind the Scenes,2,28
374,DURHAM PANKY,A Brilliant Panorama of a Girl And a Boy who must Face a Mad Scientist in An Abandoned Mine Shaft,2006,1,6,4.99,154,14.99,R,"Trailers,Commentaries",15,28
375,ENTRAPMENT SATISFACTION,A Thoughtful Panorama of a Hunter And a Teacher who must Reach a Mad Cow in A U-Boat,2006,1,5,0.99,176,19.99,R,"Commentaries,Deleted Scenes,Behind the Scenes",1,28
376,GILMORE BOILED,A Unbelieveable Documentary of a Boat And a Husband who must Succumb a Student in A U-Boat,2006,1,5,0.99,163,29.99,R,"Trailers,Behind the Scenes",4,28
377,KNOCK WARLOCK,A Unbelieveable Story of a Teacher And a Boat who must Confront a Moose in A Baloon,2006,1,4,2.99,71,21.99,PG-13,Trailers,5,28
378,LAMBS CINCINATTI,A Insightful Story of a Man And a Feminist who must Fight a Composer in Australia,2006,1,6,4.99,144,18.99,PG-13,"Trailers,Behind the Scenes",10,28
379,LOSER HUSTLER,A Stunning Drama of a Robot And a Feminist who must Outgun a Butler in Nigeria,2006,1,5,4.99,80,28.99,PG,"Deleted Scenes,Behind the Scenes",15,28
380,MAIDEN HOME,A Lacklusture Saga of a Moose And a Teacher who must Kill a Forensic Psychologist in A MySQL Convention,2006,1,3,4.99,138,9.99,PG,Behind the Scenes,13,28
381,MIDNIGHT WESTWARD,A Taut Reflection of a Husband And a A Shark who must Redeem a Pastry Chef in A Monastery,2006,1,3,0.99,86,19.99,G,"Trailers,Deleted Scenes",1,28
382,MOONWALKER FOOL,A Epic Drama of a Feminist And a Pioneer who must Sink a Composer in New Orleans,2006,1,5,4.99,184,12.99,G,"Trailers,Deleted Scenes",10,28
383,NEIGHBORS CHARADE,A Fanciful Reflection of a Crocodile And a Astronaut who must Outrace a Feminist in An Abandoned Amusement Park,2006,1,3,0.99,161,20.99,R,"Trailers,Commentaries,Deleted Scenes",15,28
384,NONE SPIKING,A Boring Reflection of a Secret Agent And a Astronaut who must Face a Composer in A Manhattan Penthouse,2006,1,3,0.99,83,18.99,NC-17,"Trailers,Commentaries",14,28
385,PAJAMA JAWBREAKER,A Emotional Drama of a Boy And a Technical Writer who must Redeem a Sumo Wrestler in California,2006,1,3,0.99,126,14.99,R,"Trailers,Deleted Scenes",4,28
386,PILOT HOOSIERS,A Awe-Inspiring Reflection of a Crocodile And a Sumo Wrestler who must Meet a Forensic Psychologist in An Abandoned Mine Shaft,2006,1,6,2.99,50,17.99,PG,"Trailers,Deleted Scenes",8,28
387,ROOM ROMAN,A Awe-Inspiring Panorama of a Composer And a Secret Agent who must Sink a Composer in A Shark Tank,2006,1,7,0.99,60,27.99,PG,"Trailers,Deleted Scenes,Behind the Scenes",2,28
388,SHOOTIST SUPERFLY,A Fast-Paced Story of a Crocodile And a A Shark who must Sink a Pioneer in Berlin,2006,1,6,0.99,67,22.99,PG-13,Trailers,7,28
389,SHRUNK DIVINE,A Fateful Character Study of a Waitress And a Technical Writer who must Battle a Hunter in A Baloon,2006,1,6,2.99,139,14.99,R,"Trailers,Deleted Scenes,Behind the Scenes",1,28
390,SNOWMAN ROLLERCOASTER,A Fateful Display of a Lumberjack And a Girl who must Succumb a Mad Cow in A Manhattan Penthouse,2006,1,3,0.99,62,27.99,G,Trailers,2,28
391,SPICE SORORITY,A Fateful Display of a Pioneer And a Hunter who must Defeat a Husband in An Abandoned Mine Shaft,2006,1,5,4.99,141,22.99,NC-17,"Trailers,Commentaries,Deleted Scenes,Behind the Scenes",7,28
392,SPY MILE,A Thrilling Documentary of a Feminist And a Feminist who must Confront a Feminist in A Baloon,2006,1,6,2.99,112,13.99,PG-13,"Trailers,Commentaries,Deleted Scenes,Behind the Scenes",10,28
393,TELEGRAPH VOYAGE,A Fateful Yarn of a Husband And a Dog who must Battle a Waitress in A Jet Boat,2006,1,3,4.99,148,20.99,PG,Commentaries,12,28
394,TRAP GUYS,A Unbelieveable Story of a Boy And a Mad Cow who must Challenge a Database Administrator in The Sahara Desert,2006,1,3,4.99,110,11.99,G,"Commentaries,Behind the Scenes",9,28
395,WAIT CIDER,A Intrepid Epistle of a Woman And a Forensic Psychologist who must Succumb a Astronaut in A Manhattan Penthouse,2006,1,3,0.99,112,9.99,PG-13,Trailers,2,28
396,WIFE TURN,A Awe-Inspiring Epistle of a Teacher And a Feminist who must Confront a Pioneer in Ancient Japan,2006,1,3,4.99,183,27.99,NC-17,"Deleted Scenes,Behind the Scenes",6,28
397,WYOMING STORM,A Awe-Inspiring Panorama of a Robot And a Boat who must Overcome a Feminist in A U-Boat,2006,1,6,4.99,100,29.99,PG-13,Deleted Scenes,13,28
398,ALIEN CENTER,A Brilliant Drama of a Cat And a Mad Scientist who must Battle a Feminist in A MySQL Convention,2006,1,5,2.99,46,10.99,NC-17,"Trailers,Commentaries,Behind the Scenes",9,36
399,BLINDNESS GUN,A Touching Drama of a Robot And a Dentist who must Meet a Hunter in A Jet Boat,2006,1,6,4.99,103,29.99,PG-13,"Trailers,Behind the Scenes",14,36
400,COMMANDMENTS EXPRESS,A Fanciful Saga of a Student And a Mad Scientist who must Battle a Hunter in An Abandoned Mine Shaft,2006,1,6,4.99,59,13.99,R,"Trailers,Commentaries,Deleted Scenes",11,36
401,DINOSAUR SECRETARY,A Action-Packed Drama of a Feminist And a Girl who must Reach a Robot in The Canadian Rockies,2006,1,7,2.99,63,27.99,R,"Trailers,Behind the Scenes",8,36
402,DOUBLE WRATH,A Thoughtful Yarn of a Womanizer And a Dog who must Challenge a Madman in The Gulf of Mexico,2006,1,4,0.99,177,28.99,R,"Trailers,Deleted Scenes,Behind the Scenes",2,36
403,ENDING CROWDS,A Unbelieveable Display of a Dentist And a Madman who must Vanquish a Squirrel in Berlin,2006,1,6,0.99,85,10.99,NC-17,"Commentaries,Behind the Scenes",13,36
404,GREEK EVERYONE,A Stunning Display of a Butler And a Teacher who must Confront a A Shark in The First Manned Space Station,2006,1,7,2.99,176,11.99,PG,"Trailers,Deleted Scenes",9,36
405,GRINCH MASSAGE,A Intrepid Display of a Madman And a Feminist who must Pursue a Pioneer in The First Manned Space Station,2006,1,7,4.99,150,25.99,R,Trailers,10,36
406,GUN BONNIE,A Boring Display of a Sumo Wrestler And a Husband who must Build a Waitress in The Gulf of Mexico,2006,1,7,0.99,100,27.99,G,Behind the Scenes,10,36
407,GUYS FALCON,A Boring Story of a Woman And a Feminist who must Redeem a Squirrel in A U-Boat,2006,1,4,4.99,84,20.99,R,"Trailers,Commentaries,Behind the Scenes",14,36
408,HEAVEN FREEDOM,A Intrepid Story of a Butler And a Car who must Vanquish a Man in New Orleans,2006,1,7,2.99,48,19.99,PG,Commentaries,5,36
409,HOME PITY,A Touching Panorama of a Man And a Secret Agent who must Challenge a Teacher in A MySQL Convention,2006,1,7,4.99,185,15.99,R,"Trailers,Commentaries,Behind the Scenes",12,36
410,HOMEWARD CIDER,A Taut Reflection of a Astronaut And a Squirrel who must Fight a Squirrel in A Manhattan Penthouse,2006,1,5,0.99,103,19.99,R,Trailers,6,36
411,IMAGE PRINCESS,A Lacklusture Panorama of a Secret Agent And a Crocodile who must Discover a Madman in The Canadian Rockies,2006,1,3,2.99,178,17.99,PG-13,"Trailers,Commentaries,Deleted Scenes",15,36
412,INTOLERABLE INTENTIONS,A Awe-Inspiring Story of a Monkey And a Pastry Chef who must Succumb a Womanizer in A MySQL Convention,2006,1,6,4.99,63,20.99,PG-13,"Commentaries,Behind the Scenes",6,36
413,JERK PAYCHECK,A Touching Character Study of a Pastry Chef And a Database Administrator who must Reach a A Shark in Ancient Japan,2006,1,3,2.99,172,13.99,NC-17,"Trailers,Commentaries,Deleted Scenes,Behind the Scenes",4,36
414,KANE EXORCIST,A Epic Documentary of a Composer And a Robot who must Overcome a Car in Berlin,2006,1,5,0.99,92,18.99,R,"Trailers,Commentaries",9,36
415,KING EVOLUTION,A Action-Packed Tale of a Boy And a Lumberjack who must Chase a Madman in A Baloon,2006,1,3,4.99,184,24.99,NC-17,"Trailers,Deleted Scenes,Behind the Scenes",8,36
416,MENAGERIE RUSHMORE,A Unbelieveable Panorama of a Composer And a Butler who must Overcome a Database Administrator in The First Manned Space Station,2006,1,7,2.99,147,18.99,G,"Trailers,Commentaries,Deleted Scenes",2,36
417,MONEY HAROLD,A Touching Tale of a Explorer And a Boat who must Defeat a Robot in Australia,2006,1,3,2.99,135,17.99,PG,"Trailers,Commentaries",13,36
418,MOTIONS DETAILS,A Awe-Inspiring Reflection of a Dog And a Student who must Kill a Car in An Abandoned Fun House,2006,1,5,0.99,166,16.99,PG,"Trailers,Commentaries,Behind the Scenes",11,36
419,RANDOM GO,A Fateful Drama of a Frisbee And a Student who must Confront a Cat in A Shark Tank,2006,1,6,2.99,73,29.99,NC-17,Trailers,14,36
420,RANGE MOONWALKER,A Insightful Documentary of a Hunter And a Dentist who must Confront a Crocodile in A Baloon,2006,1,3,4.99,147,25.99,PG,"Trailers,Commentaries,Deleted Scenes",8,36
421,REAP UNFAITHFUL,A Thrilling Epistle of a Composer And a Sumo Wrestler who must Challenge a Mad Cow in A MySQL Convention,2006,1,6,2.99,136,26.99,PG-13,"Trailers,Commentaries",11,36
422,RIGHT CRANES,A Fateful Character Study of a Boat And a Cat who must Find a Database Administrator in A Jet Boat,2006,1,7,4.99,153,29.99,PG-13,"Trailers,Commentaries,Deleted Scenes",4,36
423,TALENTED HOMICIDE,A Lacklusture Panorama of a Dentist And a Forensic Psychologist who must Outrace a Pioneer in A U-Boat,2006,1,6,0.99,173,9.99,PG,"Commentaries,Deleted Scenes,Behind the Scenes",15,36
424,TRUMAN CRAZY,A Thrilling Epistle of a Moose And a Boy who must Meet a Database Administrator in A Monastery,2006,1,7,4.99,92,9.99,G,"Trailers,Commentaries",1,36
425,VALENTINE VANISHING,A Thrilling Display of a Husband And a Butler who must Reach a Pastry Chef in California,2006,1,7,0.99,48,9.99,PG-13,"Trailers,Behind the Scenes",16,36
426,WANDA CHAMBER,A Insightful Drama of a A Shark And a Pioneer who must Find a Womanizer in The Outback,2006,1,7,4.99,107,23.99,PG-13,"Commentaries,Deleted Scenes,Behind the Scenes",10,36
427,ALLEY EVOLUTION,A Fast-Paced Drama of a Robot And a Composer who must Battle a Astronaut in New Orleans,2006,1,6,2.99,180,23.99,NC-17,"Trailers,Commentaries",9,12
428,ALONE TRIP,A Fast-Paced Character Study of a Composer And a Dog who must Outgun a Boat in An Abandoned Fun House,2006,1,3,0.99,82,14.99,R,"Trailers,Behind the Scenes",12,12
429,ARABIA DOGMA,A Touching Epistle of a Madman And a Mad Cow who must Defeat a Student in Nigeria,2006,1,6,0.99,62,29.99,NC-17,"Commentaries,Deleted Scenes",11,12
430,ARIZONA BANG,A Brilliant Panorama of a Mad Scientist And a Mad Cow who must Meet a Pioneer in A Monastery,2006,1,3,2.99,121,28.99,PG,"Trailers,Deleted Scenes",4,12
431,BOUND CHEAPER,A Thrilling Panorama of a Database Administrator And a Astronaut who must Challenge a Lumberjack in A Baloon,2006,1,5,0.99,98,17.99,PG,Behind the Scenes,4,12
432,BOWFINGER GABLES,A Fast-Paced Yarn of a Waitress And a Composer who must Outgun a Dentist in California,2006,1,7,4.99,72,19.99,NC-17,"Trailers,Deleted Scenes",11,12
433,BUNCH MINDS,A Emotional Story of a Feminist And a Feminist who must Escape a Pastry Chef in A MySQL Convention,2006,1,4,2.99,63,13.99,G,Behind the Scenes,7,12
434,CLEOPATRA DEVIL,A Fanciful Documentary of a Crocodile And a Technical Writer who must Fight a A Shark in A Baloon,2006,1,6,0.99,150,26.99,PG-13,"Trailers,Deleted Scenes,Behind the Scenes",13,12
